{
  "lessonId": "d1-feedback-matrix",
  "sourceDigest": "9e8e66b34e17",
  "generator": {
    "provider": "gemini",
    "model": "gemini-3.6-flash",
    "promptVersion": "audio-2026-08-27",
    "generatedAt": "2026-08-28T01:13:49Z"
  },
  "turns": [
    {
      "speaker": "guide",
      "text": "Знаешь, у меня ощущение, что мы чиним в продукте просто то, о чём громче всего кричат в поддержке."
    },
    {
      "speaker": "expert",
      "text": "И это классическая ловушка. Один настойчивый клиент пришлёт четыре длинных письма, а сотня других просто молча уйдёт."
    },
    {
      "speaker": "guide",
      "text": "А в конце квартала список задач закрыт, но метрики вообще не изменились, да?"
    },
    {
      "speaker": "expert",
      "text": "Именно. Сообщения из чатов, сторов и почты — это не список проблем, а просто сырой поток. Чтобы разглядеть за ним реальность, нужна матрица обратной связи."
    },
    {
      "speaker": "guide",
      "text": "Как она работает?"
    },
    {
      "speaker": "expert",
      "text": "Каждое сообщение раскладывается по двум осям. Первая — что человек пытался сделать: зарегистрироваться, составить график, оплатить или обменяться сменами."
    },
    {
      "speaker": "guide",
      "text": "Так, а вторая ось?"
    },
    {
      "speaker": "expert",
      "text": "Что именно пошло не так: не нашёл, не понял, не сработало или не хватает возможности. Пересечение осей и есть формулировка проблемы."
    },
    {
      "speaker": "guide",
      "text": "То есть абстрактное «мне неудобно» превращается в конкретную точку?"
    },
    {
      "speaker": "expert",
      "text": "Именно. Вот в сервисе «Смена» за месяц собрали 62 сообщения. Громче всех казался владелец сети из шести точек, который исписал всё про отчёты."
    },
    {
      "speaker": "guide",
      "text": "И все бросились делать отчёты?"
    },
    {
      "speaker": "expert",
      "text": "А в матрице его письма собрались в одну ячейку от одного человека. Зато вскрылась массовая проблема: 21 сообщение про то, что сотрудники не понимают, подтвердился ли обмен сменами."
    },
    {
      "speaker": "guide",
      "text": "Слушай, а если один активный пользователь напишет двадцать одно сообщение в одну ячейку?"
    },
    {
      "speaker": "expert",
      "text": "Вот поэтому важно считать не просто сообщения, а количество разных аккаунтов. Двадцать один сигнал от девятнадцати клиентов и от троих — это совершенно разные ситуации."
    },
    {
      "speaker": "guide",
      "text": "Получается, берем самую заполненную ячейку по аккаунтам и сразу бежим чинить?"
    },
    {
      "speaker": "expert",
      "text": "Не спеши. Матрица показывает частоту, а не важность. Ячейка с тремя сообщениями может быть критичнее, если эти трое приносят половину вашей выручки. К тому же молчунов матрица не видит."
    },
    {
      "speaker": "guide",
      "text": "Что в итоге нужно запомнить?"
    },
    {
      "speaker": "expert",
      "text": "Обратная связь — это сырьё, а не готовое задание. Настоящая проблема появляется только после группировки сообщений по действию пользователя, а не по громкости его эмоций."
    }
  ]
}
